{
  "category": "length",
  "baseUnit": "meter",
  "description": "Length and distance units for engineering applications",
  "units": {
    "meter": {
      "name": "meter",
      "symbol": "m",
      "aliases": ["meter", "metre", "meters", "metres", "m"],
      "description": "SI base unit of length",
      "transform": { "toBase": "x", "fromBase": "x" }
    },
    "foot": {
      "name": "foot",
      "symbol": "ft",
      "aliases": ["foot", "feet", "ft", "'"],
      "description": "Imperial unit of length",
      "transform": { "toBase": "x * 0.3048", "fromBase": "x / 0.3048" }
    },
    "inch": {
      "name": "inch",
      "symbol": "in",
      "aliases": ["inch", "inches", "in", "\""],
      "description": "Imperial unit of length, 1/12 of a foot",
      "transform": { "toBase": "x * 0.0254", "fromBase": "x / 0.0254" }
    },
    "centimeter": {
      "name": "centimeter",
      "symbol": "cm",
      "aliases": [
        "centimeter",
        "centimetre",
        "centimeters",
        "centimetres",
        "cm"
      ],
      "description": "Metric unit, 1/100 of a meter",
      "transform": { "toBase": "x * 0.01", "fromBase": "x / 0.01" }
    },
    "millimeter": {
      "name": "millimeter",
      "symbol": "mm",
      "aliases": [
        "millimeter",
        "millimetre",
        "millimeters",
        "millimetres",
        "mm"
      ],
      "description": "Metric unit, 1/1000 of a meter",
      "transform": { "toBase": "x * 0.001", "fromBase": "x / 0.001" }
    },
    "kilometer": {
      "name": "kilometer",
      "symbol": "km",
      "aliases": ["kilometer", "kilometre", "kilometers", "kilometres", "km"],
      "description": "Metric unit, 1000 meters",
      "transform": { "toBase": "x * 1000", "fromBase": "x / 1000" }
    },
    "yard": {
      "name": "yard",
      "symbol": "yd",
      "aliases": ["yard", "yards", "yd"],
      "description": "Imperial unit, 3 feet",
      "transform": { "toBase": "x * 0.9144", "fromBase": "x / 0.9144" }
    },
    "mile": {
      "name": "mile",
      "symbol": "mi",
      "aliases": ["mile", "miles", "mi"],
      "description": "Imperial unit, 5280 feet",
      "transform": { "toBase": "x * 1609.344", "fromBase": "x / 1609.344" }
    },
    "micrometer": {
      "name": "micrometer",
      "symbol": "μm",
      "aliases": [
        "micrometer",
        "micrometre",
        "micrometers",
        "micrometres",
        "μm",
        "um",
        "micron",
        "microns"
      ],
      "description": "Metric unit, 1/1,000,000 of a meter",
      "transform": { "toBase": "x * 0.000001", "fromBase": "x / 0.000001" }
    },
    "nanometer": {
      "name": "nanometer",
      "symbol": "nm",
      "aliases": ["nanometer", "nanometre", "nanometers", "nanometres", "nm"],
      "description": "Metric unit, 1/1,000,000,000 of a meter",
      "transform": {
        "toBase": "x * 0.000000001",
        "fromBase": "x / 0.000000001"
      }
    },
    "mil": {
      "name": "mil",
      "symbol": "mil",
      "aliases": ["mil", "mils", "thou", "thousandth"],
      "description": "Imperial unit, 1/1000 of an inch",
      "transform": { "toBase": "x * 0.0000254", "fromBase": "x / 0.0000254" }
    },
    "nautical_mile": {
      "name": "nautical mile",
      "symbol": "nmi",
      "aliases": ["nautical mile", "nautical miles", "nmi", "nmile"],
      "description": "Maritime and aviation unit, exactly 1852 meters",
      "transform": { "toBase": "x * 1852", "fromBase": "x / 1852" }
    },
    "light_year": {
      "name": "light year",
      "symbol": "ly",
      "aliases": ["light year", "light years", "lightyear", "lightyears", "ly"],
      "description": "Astronomical unit, distance light travels in one year",
      "transform": {
        "toBase": "x * 9.4607304725808e15",
        "fromBase": "x / 9.4607304725808e15"
      }
    },
    "parsec": {
      "name": "parsec",
      "symbol": "pc",
      "aliases": ["parsec", "parsecs", "pc"],
      "description": "Astronomical unit, approximately 3.26 light years",
      "transform": {
        "toBase": "x * 3.0856775814913673e16",
        "fromBase": "x / 3.0856775814913673e16"
      }
    },
    "furlong": {
      "name": "furlong",
      "symbol": "fur",
      "aliases": ["furlong", "furlongs", "fur"],
      "description": "Imperial unit, 1/8 of a mile or 660 feet",
      "transform": { "toBase": "x * 201.168", "fromBase": "x / 201.168" }
    },
    "chain": {
      "name": "chain",
      "symbol": "ch",
      "aliases": ["chain", "chains", "ch"],
      "description": "Surveying unit, 66 feet or 1/80 of a mile",
      "transform": { "toBase": "x * 20.1168", "fromBase": "x / 20.1168" }
    },
    "rod": {
      "name": "rod",
      "symbol": "rd",
      "aliases": ["rod", "rods", "rd", "pole", "poles", "perch", "perches"],
      "description": "Imperial unit, 16.5 feet or 1/4 of a chain",
      "transform": { "toBase": "x * 5.0292", "fromBase": "x / 5.0292" }
    },
    "fathom": {
      "name": "fathom",
      "symbol": "ftm",
      "aliases": ["fathom", "fathoms", "ftm"],
      "description": "Maritime unit, 6 feet",
      "transform": { "toBase": "x * 1.8288", "fromBase": "x / 1.8288" }
    }
  }
}
