{
  "category": "area",
  "baseUnit": "square_meter",
  "description": "Area units for engineering and surveying (SI and common imperial units)",
  "units": {
    "square_meter": {
      "name": "square meter",
      "symbol": "m²",
      "aliases": ["square meter", "square meters", "m2", "m^2", "m²"],
      "description": "SI base unit of area",
      "transform": { "toBase": "x", "fromBase": "x" }
    },
    "square_centimeter": {
      "name": "square centimeter",
      "symbol": "cm²",
      "aliases": [
        "square centimeter",
        "square centimetre",
        "square centimeters",
        "square centimetres",
        "cm2",
        "cm^2",
        "cm²"
      ],
      "description": "1 square centimeter = 0.0001 square meters",
      "transform": { "toBase": "x * 0.0001", "fromBase": "x / 0.0001" }
    },
    "square_millimeter": {
      "name": "square millimeter",
      "symbol": "mm²",
      "aliases": [
        "square millimeter",
        "square millimetre",
        "square millimeters",
        "square millimetres",
        "mm2",
        "mm^2",
        "mm²"
      ],
      "description": "1 square millimeter = 0.000001 square meters",
      "transform": { "toBase": "x * 0.000001", "fromBase": "x / 0.000001" }
    },
    "square_kilometer": {
      "name": "square kilometer",
      "symbol": "km²",
      "aliases": [
        "square kilometer",
        "square kilometre",
        "square kilometers",
        "square kilometres",
        "km2",
        "km^2",
        "km²"
      ],
      "description": "1 square kilometer = 1,000,000 square meters",
      "transform": { "toBase": "x * 1000000", "fromBase": "x / 1000000" }
    },
    "square_inch": {
      "name": "square inch",
      "symbol": "in²",
      "aliases": [
        "square inch",
        "square inches",
        "in2",
        "in^2",
        "in²",
        "inch^2",
        "inch2"
      ],
      "description": "1 square inch = 0.00064516 square meters",
      "transform": { "toBase": "x * 0.00064516", "fromBase": "x / 0.00064516" }
    },
    "square_foot": {
      "name": "square foot",
      "symbol": "ft²",
      "aliases": [
        "square foot",
        "square feet",
        "ft2",
        "ft^2",
        "ft²",
        "sq ft",
        "sqft"
      ],
      "description": "1 square foot = 0.09290304 square meters",
      "transform": { "toBase": "x * 0.09290304", "fromBase": "x / 0.09290304" }
    },
    "square_yard": {
      "name": "square yard",
      "symbol": "yd²",
      "aliases": [
        "square yard",
        "square yards",
        "yd2",
        "yd^2",
        "yd²",
        "sq yd",
        "sqyd"
      ],
      "description": "1 square yard = 0.83612736 square meters",
      "transform": { "toBase": "x * 0.83612736", "fromBase": "x / 0.83612736" }
    },
    "square_mile": {
      "name": "square mile",
      "symbol": "mi²",
      "aliases": ["square mile", "square miles", "mi2", "mi^2", "mi²"],
      "description": "1 square mile = 2,589,988.110336 square meters",
      "transform": {
        "toBase": "x * 2589988.110336",
        "fromBase": "x / 2589988.110336"
      }
    },
    "acre": {
      "name": "acre",
      "symbol": "ac",
      "aliases": ["acre", "acres", "ac"],
      "description": "Imperial unit commonly used in land measurement",
      "transform": {
        "toBase": "x * 4046.8564224",
        "fromBase": "x / 4046.8564224"
      }
    },
    "hectare": {
      "name": "hectare",
      "symbol": "ha",
      "aliases": ["hectare", "hectares", "ha"],
      "description": "Metric land measure, 1 hectare = 10,000 square meters",
      "transform": { "toBase": "x * 10000", "fromBase": "x / 10000" }
    }
  }
}
